{
  "project": "surreal-ads",
  "title": "Velocità — BUILT FOR THE LAST LAP",
  "logline": "מכונית הפורמולה 1 פורץ ממסך האתר, מתעמת עם האותיות הענקיות FAST ונרגע לשוט הירו עם \"BUILT FOR THE LAST LAP\".",
  "language": "he",
  "aspect_ratio": "9:16",
  "series": {
    "name": "surreal-product-ad",
    "version": 2,
    "slug": "f1",
    "brief": {
      "slug": "f1",
      "brand": "Velocità",
      "product": "a highly detailed 1:8 scale model of a modern Formula 1 car in gloss racing red with white accents, carbon-fibre aero parts, slick tyres and 'VELOCITÀ' livery on the sidepods",
      "product_short": "the red VELOCITÀ Formula 1 car",
      "product_he": "מכונית הפורמולה 1",
      "website": "a sleek racing-team website with a bold red hero banner, the serif-italic logo 'VELOCITÀ', a photo of the car, and the giant editorial headline 'FAST'",
      "hero_word": "FAST",
      "letter_material": "brushed carbon fibre with red-and-white racing kerb stripes along their edges",
      "emergence": "the nose wing of the car pierces through the screen glass first, then the whole car rolls out of the website onto the oak table, tyre smoke spilling from the screen behind it",
      "transformation": "a strip of wet race-track asphalt unrolls across the table under the car, rain spray and tyre smoke swirl into the giant letters, the car accelerates in place with spinning wheels and streaks of motion blur",
      "transformation_he": "רצועת אספלט רטוב של מסלול נפרשת על השולחן, ריסוס גשם ועשן צמיגים מסתחררים לתוך האותיות והמכונית מאיצה במקום",
      "particles": "tyre smoke, rain spray droplets, tiny rubber flecks",
      "accent_color": "racing red and carbon black",
      "accent_hex": "#C8102E",
      "text_hex": "#1B1B1B",
      "hero_shot": "the car frozen perfectly still on a strip of glistening wet asphalt on the oak table, red-and-white kerbs at its sides, sharp reflections underneath",
      "tagline": "BUILT FOR THE LAST LAP",
      "image_route": "gpt",
      "typography_mode": "hybrid",
      "look": "hyperreal",
      "drawn_mode": "none"
    },
    "image_route": "gpt",
    "typography_mode": "hybrid",
    "keyframes": [
      {
        "id": "k0",
        "label": "K0 — plain website",
        "path": "bambi/outputs/surreal-ads/2026-10-09-f1/keyframes/k0.png",
        "image_prompt": "Vertical 9:16 hyperrealistic commercial product photograph, indistinguishable from a real high-end camera capture. A silver MacBook Pro standing open on a warm natural oak table, a soft linen cloth and a ceramic cup at the edge of frame, a sunlit cream plaster wall behind. On the laptop screen: a sleek racing-team website with a bold red hero banner, the serif-italic logo 'VELOCITÀ', a photo of the car, and the giant editorial headline 'FAST'. Everything is completely normal and calm — nothing has emerged yet. The laptop fills the central two thirds of the frame, slightly angled toward camera. Hyperrealistic: real-world materials, physically correct light, reflections, refraction and shadows; every surreal element obeys real physics and looks photographed, not rendered. Palette: cream, warm beige, natural oak, soft off-white + brand accent racing red and carbon black. Lighting: motivated natural window daylight from camera-left with physically accurate global illumination, soft contact shadows, real bounce light and specular highlights. Look: shot on ARRI Alexa 35 with a Cooke S7/i 50mm and a Laowa probe macro for close-ups, true optical depth of field and lens breathing, micro-detail (surface pores, fibres, dust motes, fine scratches), accurate refraction and caustics in glass and liquid, subsurface scattering, real-world scale, natural film grain, ungraded-to-premium color.",
        "mj_prompt": "silver MacBook Pro open on a warm oak table, cream plaster wall, linen cloth, the laptop screen shows a sleek racing-team website with a bold red hero banner, the serif-italic logo 'VELOCITÀ', a photo of the car, and the giant editorial headline 'FAST', everything calm and normal, laptop fills the center of the vertical frame, hyperrealistic commercial photography, shot on ARRI Alexa 35 with Cooke 50mm, real optical depth of field, micro-detail, natural film grain, soft window daylight from the left, cream and oak palette with racing red and carbon black accents",
        "references": [
          "bambi/cast/surreal-ads/f1-product.png"
        ]
      },
      {
        "id": "k1",
        "label": "K1 — product half-out",
        "path": "bambi/outputs/surreal-ads/2026-10-09-f1/keyframes/k1.png",
        "image_prompt": "Vertical 9:16 hyperrealistic commercial product photograph, indistinguishable from a real high-end camera capture, the exact same laptop, table, wall and light as the reference scene. The red VELOCITÀ Formula 1 car is physically emerging from the laptop screen: the nose wing of the car pierces through the screen glass first, then the whole car rolls out of the website onto the oak table, tyre smoke spilling from the screen behind it. About half of the product is already out in the real room, casting a real contact shadow on the oak table; the rest is still inside the website. The giant editorial serif letters spelling exactly \"FAST\" (F-A-S-T) are starting to lift off the web page, about to become physical. Hyperrealistic: real-world materials, physically correct light, reflections, refraction and shadows; every surreal element obeys real physics and looks photographed, not rendered. Palette: cream, warm beige, natural oak, soft off-white + brand accent racing red and carbon black. Lighting: motivated natural window daylight from camera-left with physically accurate global illumination, soft contact shadows, real bounce light and specular highlights. Look: shot on ARRI Alexa 35 with a Cooke S7/i 50mm and a Laowa probe macro for close-ups, true optical depth of field and lens breathing, micro-detail (surface pores, fibres, dust motes, fine scratches), accurate refraction and caustics in glass and liquid, subsurface scattering, real-world scale, natural film grain, ungraded-to-premium color.",
        "mj_prompt": "the red VELOCITÀ Formula 1 car physically bursting out of a MacBook screen onto a warm oak table: the nose wing of the car pierces through the screen glass first, then the whole car rolls out of the website onto the oak table, tyre smoke spilling from the screen behind it, half of it still inside the screen, giant serif letters \"FAST\" lifting off the web page, real contact shadow, hyperrealistic commercial photography, shot on ARRI Alexa 35 with Cooke 50mm, real optical depth of field, micro-detail, natural film grain, soft window daylight from the left, cream and oak palette with racing red and carbon black accents",
        "references": [
          "bambi/cast/surreal-ads/f1-product.png",
          "bambi/outputs/surreal-ads/2026-10-09-f1/keyframes/k0.png"
        ]
      },
      {
        "id": "k2",
        "label": "K2 — transformation peak",
        "path": "bambi/outputs/surreal-ads/2026-10-09-f1/keyframes/k2.png",
        "image_prompt": "Vertical 9:16 hyperrealistic commercial product photograph, indistinguishable from a real high-end camera capture, a surreal moment captured for real — same oak table and cream wall, the camera now closer and slightly orbited. The peak of a magical transformation: a strip of wet race-track asphalt unrolls across the table under the car, rain spray and tyre smoke swirl into the giant letters, the car accelerates in place with spinning wheels and streaks of motion blur. Huge physical 3D letters spelling exactly \"FAST\" (F-A-S-T), made of brushed carbon fibre with red-and-white racing kerb stripes along their edges, stand on the table around the product — some behind it, one partially in front of it, partially occluding it. Every letter correctly spelled. Tyre smoke, rain spray droplets, tiny rubber flecks frozen mid-motion as if shot at 1/8000s, with a hint of motion blur on the fastest elements. The laptop is still softly visible behind, its screen blending into the room. The product is exactly as in the reference — a highly detailed 1:8 scale model of a modern Formula 1 car in gloss racing red with white accents, carbon-fibre aero parts, slick tyres and 'VELOCITÀ' livery on the sidepods — accurate proportions, 'Velocità' branding readable. Hyperrealistic: real-world materials, physically correct light, reflections, refraction and shadows; every surreal element obeys real physics and looks photographed, not rendered. Palette: cream, warm beige, natural oak, soft off-white + brand accent racing red and carbon black. Lighting: motivated natural window daylight from camera-left with physically accurate global illumination, soft contact shadows, real bounce light and specular highlights. Look: shot on ARRI Alexa 35 with a Cooke S7/i 50mm and a Laowa probe macro for close-ups, true optical depth of field and lens breathing, micro-detail (surface pores, fibres, dust motes, fine scratches), accurate refraction and caustics in glass and liquid, subsurface scattering, real-world scale, natural film grain, ungraded-to-premium color.",
        "mj_prompt": "surreal moment captured for real: a strip of wet race-track asphalt unrolls across the table under the car, rain spray and tyre smoke swirl into the giant letters, the car accelerates in place with spinning wheels and streaks of motion blur, giant 3D letters \"FAST\" made of brushed carbon fibre with red-and-white racing kerb stripes along their edges standing around the red VELOCITÀ Formula 1 car, some behind it, one in front, tyre smoke, rain spray droplets, tiny rubber flecks frozen mid-air, MacBook softly out of focus behind, camera close and slightly orbited, hyperrealistic commercial photography, shot on ARRI Alexa 35 with Cooke 50mm, real optical depth of field, micro-detail, natural film grain, soft window daylight from the left, cream and oak palette with racing red and carbon black accents",